{
  "schema_version": "0.1",
  "generated_at": "2026-06-02T02:03:15.754667+00:00",
  "source": {
    "spreadsheet_id": "1gp3jl_DyB8kvxHO7m4YjsCPbFTPGi-XKyqPhGAlTZ60",
    "spreadsheet_url": "https://docs.google.com/spreadsheets/d/1gp3jl_DyB8kvxHO7m4YjsCPbFTPGi-XKyqPhGAlTZ60/edit?ouid=112662517307801676490",
    "title": "[Day 1] 1.0 (from 20250707)",
    "locale": "ko_KR",
    "time_zone": "Asia/Seoul",
    "source_artifacts": {
      "access_preflight": "access-preflight.json",
      "inspection": "inspection.json",
      "top_left_sample": "top-left-sample.json"
    }
  },
  "authority": {
    "source_document": "live_google_sheet",
    "access_mode": "sheets_api_readonly_with_domain_wide_delegation",
    "service_account_email": "day1-mcp-wrapper@day1-dev.iam.gserviceaccount.com",
    "impersonated_subject": "kangmin.lee@day1company.co.kr",
    "direct_service_account_access": {
      "mode": "service_account_direct",
      "status": "http_error",
      "http_status": 403,
      "reason": "Forbidden"
    },
    "xlsx_round_trip": "not_used",
    "write_operation": "not_performed"
  },
  "limits": {
    "profile_range": "A1:Z80",
    "value_sample_authorities": [
      "FORMULA",
      "FORMATTED_VALUE"
    ],
    "grid_profile_authority": "Sheets API includeGridData readonly",
    "formula_result_authority": "not_established"
  },
  "live_fetch": {
    "performed": true,
    "scope": "https://www.googleapis.com/auth/spreadsheets.readonly",
    "request_count": 7,
    "range_count": 52,
    "elapsed_ms": 18577,
    "credential_handling": "external_key_file_used_not_copied"
  },
  "workbook": {
    "sheet_count": 52,
    "sheets": [
      {
        "name": "26_0601",
        "sheet_id": 1578292062,
        "index": 0,
        "state": "visible",
        "dimensions": {
          "row_count": 1880,
          "column_count": 121,
          "frozen_row_count": 1,
          "frozen_column_count": 0
        },
        "profile_window": {
          "range": "A1:Z80",
          "grid_data_fetched": true
        },
        "sample_counts": {
          "non_empty_cell_count_in_sample": 208,
          "formula_cell_count_in_sample": 0
        },
        "grid_counts": {
          "non_empty_cell_count": 208,
          "string_cell_count": 108,
          "number_cell_count": 100
        },
        "view_state_counts": {
          "hidden_rows_in_profile_window": 0,
          "filtered_rows_in_profile_window": 0,
          "hidden_columns_in_profile_window": 0
        },
        "object_counts": {
          "charts": 8,
          "banded_ranges": 22,
          "protected_ranges": 0,
          "filter_views": 0,
          "basic_filter": 0,
          "merges_in_profile_window": 8
        },
        "style_counts": {
          "bold_cell_count": 23,
          "filled_cell_count": 20,
          "bordered_cell_count": 455,
          "data_validation_cell_count": 0,
          "note_cell_count": 0
        },
        "formula_counts": {
          "formula_cell_count": 0,
          "dynamic_formula_cell_count": 0,
          "classification_counts": {},
          "cross_sheet_formula_count": 0
        },
        "role_hints": [
          "period_tab",
          "banded_table_surface",
          "styled_document_surface"
        ],
        "risk_flags": []
      },
      {
        "name": "26_0525",
        "sheet_id": 530035613,
        "index": 1,
        "state": "visible",
        "dimensions": {
          "row_count": 1828,
          "column_count": 121,
          "frozen_row_count": 1,
          "frozen_column_count": 0
        },
        "profile_window": {
          "range": "A1:Z80",
          "grid_data_fetched": true
        },
        "sample_counts": {
          "non_empty_cell_count_in_sample": 35,
          "formula_cell_count_in_sample": 0
        },
        "grid_counts": {
          "non_empty_cell_count": 35,
          "string_cell_count": 35
        },
        "view_state_counts": {
          "hidden_rows_in_profile_window": 0,
          "filtered_rows_in_profile_window": 0,
          "hidden_columns_in_profile_window": 0
        },
        "object_counts": {
          "charts": 23,
          "banded_ranges": 22,
          "protected_ranges": 0,
          "filter_views": 0,
          "basic_filter": 0,
          "merges_in_profile_window": 10
        },
        "style_counts": {
          "bold_cell_count": 106,
          "filled_cell_count": 45,
          "bordered_cell_count": 297,
          "data_validation_cell_count": 0,
          "note_cell_count": 0
        },
        "formula_counts": {
          "formula_cell_count": 0,
          "dynamic_formula_cell_count": 0,
          "classification_counts": {},
          "cross_sheet_formula_count": 0
        },
        "role_hints": [
          "period_tab",
          "chart_heavy_surface",
          "banded_table_surface",
          "styled_document_surface"
        ],
        "risk_flags": []
      },
      {
        "name": "26_0518",
        "sheet_id": 539550221,
        "index": 2,
        "state": "visible",
        "dimensions": {
          "row_count": 1908,
          "column_count": 121,
          "frozen_row_count": 1,
          "frozen_column_count": 0
        },
        "profile_window": {
          "range": "A1:Z80",
          "grid_data_fetched": true
        },
        "sample_counts": {
          "non_empty_cell_count_in_sample": 35,
          "formula_cell_count_in_sample": 0
        },
        "grid_counts": {
          "non_empty_cell_count": 35,
          "string_cell_count": 35
        },
        "view_state_counts": {
          "hidden_rows_in_profile_window": 0,
          "filtered_rows_in_profile_window": 0,
          "hidden_columns_in_profile_window": 0
        },
        "object_counts": {
          "charts": 23,
          "banded_ranges": 21,
          "protected_ranges": 0,
          "filter_views": 0,
          "basic_filter": 0,
          "merges_in_profile_window": 10
        },
        "style_counts": {
          "bold_cell_count": 105,
          "filled_cell_count": 45,
          "bordered_cell_count": 297,
          "data_validation_cell_count": 0,
          "note_cell_count": 0
        },
        "formula_counts": {
          "formula_cell_count": 0,
          "dynamic_formula_cell_count": 0,
          "classification_counts": {},
          "cross_sheet_formula_count": 0
        },
        "role_hints": [
          "period_tab",
          "chart_heavy_surface",
          "banded_table_surface",
          "styled_document_surface"
        ],
        "risk_flags": []
      },
      {
        "name": "26_0511",
        "sheet_id": 1757205497,
        "index": 3,
        "state": "visible",
        "dimensions": {
          "row_count": 1922,
          "column_count": 121,
          "frozen_row_count": 1,
          "frozen_column_count": 0
        },
        "profile_window": {
          "range": "A1:Z80",
          "grid_data_fetched": true
        },
        "sample_counts": {
          "non_empty_cell_count_in_sample": 33,
          "formula_cell_count_in_sample": 0
        },
        "grid_counts": {
          "non_empty_cell_count": 33,
          "string_cell_count": 33
        },
        "view_state_counts": {
          "hidden_rows_in_profile_window": 0,
          "filtered_rows_in_profile_window": 0,
          "hidden_columns_in_profile_window": 0
        },
        "object_counts": {
          "charts": 27,
          "banded_ranges": 20,
          "protected_ranges": 0,
          "filter_views": 0,
          "basic_filter": 0,
          "merges_in_profile_window": 10
        },
        "style_counts": {
          "bold_cell_count": 105,
          "filled_cell_count": 45,
          "bordered_cell_count": 297,
          "data_validation_cell_count": 0,
          "note_cell_count": 0
        },
        "formula_counts": {
          "formula_cell_count": 0,
          "dynamic_formula_cell_count": 0,
          "classification_counts": {},
          "cross_sheet_formula_count": 0
        },
        "role_hints": [
          "period_tab",
          "chart_heavy_surface",
          "banded_table_surface",
          "styled_document_surface"
        ],
        "risk_flags": []
      },
      {
        "name": "26_0504",
        "sheet_id": 1849044614,
        "index": 4,
        "state": "visible",
        "dimensions": {
          "row_count": 1924,
          "column_count": 121,
          "frozen_row_count": 1,
          "frozen_column_count": 0
        },
        "profile_window": {
          "range": "A1:Z80",
          "grid_data_fetched": true
        },
        "sample_counts": {
          "non_empty_cell_count_in_sample": 35,
          "formula_cell_count_in_sample": 0
        },
        "grid_counts": {
          "non_empty_cell_count": 35,
          "string_cell_count": 35
        },
        "view_state_counts": {
          "hidden_rows_in_profile_window": 0,
          "filtered_rows_in_profile_window": 0,
          "hidden_columns_in_profile_window": 0
        },
        "object_counts": {
          "charts": 27,
          "banded_ranges": 17,
          "protected_ranges": 0,
          "filter_views": 0,
          "basic_filter": 0,
          "merges_in_profile_window": 10
        },
        "style_counts": {
          "bold_cell_count": 105,
          "filled_cell_count": 45,
          "bordered_cell_count": 297,
          "data_validation_cell_count": 0,
          "note_cell_count": 0
        },
        "formula_counts": {
          "formula_cell_count": 0,
          "dynamic_formula_cell_count": 0,
          "classification_counts": {},
          "cross_sheet_formula_count": 0
        },
        "role_hints": [
          "period_tab",
          "chart_heavy_surface",
          "banded_table_surface",
          "styled_document_surface"
        ],
        "risk_flags": []
      },
      {
        "name": "26_0427",
        "sheet_id": 1154473110,
        "index": 5,
        "state": "visible",